{
	"dataFile": "",
	"genType": "",
	"spatio-temporal": {
		"duplicateDetection": [
			"trip_id",
			"observationDateTime"
		],
		"suppressCols": [
			"trip_direction",
			"last_stop_arrival_time",
			"route_id",
			"actual_trip_start_time",
			"trip_delay",
			"vehicle_label",
			"id",
			"location.type",
			"trip_id"
		],
		"outputOptions": 0,
		"pseudoCol": "license_plate",
		"locationCol": "location.coordinates",
		"datetimeCol": "observationDateTime",
		"trueValue": "speed",
		"groupByCol": "speed",
		"localityFactor": 0,
		"winsorizeLowerBound": 0.01,
		"winsorizeUpperBound": 0.99,
		"globalMaxValue": 65,
		"globalMinValue": 0, 
		"privacyLossBudgetEpsQuery": [
			10,
			10
		],
		"h3Resolution": 7,
		"startTime": 9,
		"endTime": 20,
		"minEventOccurences": 30,
		"trueValueThreshold": 35,
		"snrUpperLimit" : 3,
		"snrLowerLimit" : 0
	},
	"categorical": {
		"duplicateDetection": [
			"Sample No."
		],
		"queryPer":"subdistrict",
		"splitCols":[
			"pH",
			"EC",
			"OC",
			"N",
			"P",
			"K",
			"S",
			"Zn",
			"Fe",
			"Cu", 
			"Mn", 
			"B"],
		"suppressCols": [
			"Farmer Name",
			"Land Area",
			"Khasra No./ Dag No.",
			"Survey No.",
			"Longitude",
			"Latitude"],
		"groupByCols":[
			"N",
			"P",
			"K"
		],
		"groupByPairs":[["N","P"], ["Zn","Fe"],["N","pH"],["OC","EC"]],
		"ID":"Sample No.",
		"cycleToDrop":["2019-20-to-2020-2021"],
		"cycleToKeep":["2017-18-to-2018-19"],
		"PrivacyLossBudget":[5, 5],
		"snrUpperLimit" : 3,
		"snrLowerLimit" : 0,
		"outputOptions": 0	
		},
	"genAgg":{
		"duplicateDetection": [],
		"suppressCols": ["subCategory","comments"],
		"datetimeCol": "observationDateTime"	
		}
}